,VARIETY,BOTANICAL_NAME,PRONUNCIATION,ALIASES,DESCRIPTION,ZONE,MIN_TEMP,DIFFICULTY,HEIGHT,SPREAD,GROWTH_RATE,COMPANION_PLANTS,BLOOMING_FRUITING,SUMMER_FOLIAGE,FALL_FOLIAGE,FLOWER_COLOR,USES_CHARACTERISTICS,PRICE,DEER_RESISTANT,DROUGHT_TOLERANT,ATTRACTS_POLLINATORS,GROUND_COVER,OTHER
1034,Hillbilly Tomato,Lycopersicon esculentum,Like-OH-purr-see-cone es-COE-len-tum,,"Undeniably delicious. Weighs in at 1-2 lb. Heavily ribbed fruits bring superb, sweet, low acid flavor to salads and sandwiches. 16-32 oz.",44630,40°,,48-72”,24-36”,,"Another sensitive plant when it comes to companions, tomatoes benefit from asparagus, basil, beans, borage, carrots, celery, chives, collards, cucumber, garlic, lettuce, marigold, mint, nasturtium, onion, parsley, and peppers. Avoid planting alongside Brassicas and dill. Corn will attract tomato pests, and kohlrabi will stunt tomatoes’ growth. Potatoes may spread blight to tomatoes, so keep them apart. Do no plant tomatoes near walnut trees.",85-95 days to harvest,Green,Green,Yellow,Yellow orange; XL fruit; BEEFSTEAK; Above 50° is optimal; 40° is minimal,3.5,,,,,
1035,Indigo Rose Hybrid Tomato,Lycopersicon esculentum,Like-OH-purr-see-cone es-COE-len-tum,,"Stunning clusters of 2-3 purple-black fruits that turn a rosy red when ripe. Deep red flesh with strong acidic flavor. High levels of anthocyanin. Breeder s rule of thumb: If you think it s ripe, wait three more days before you pick it. 1-2 oz.",44630,40°,,36-48”,24-36”,,"Another sensitive plant when it comes to companions, tomatoes benefit from asparagus, basil, beans, borage, carrots, celery, chives, collards, cucumber, garlic, lettuce, marigold, mint, nasturtium, onion, parsley, and peppers. Avoid planting alongside Brassicas and dill. Corn will attract tomato pests, and kohlrabi will stunt tomatoes’ growth. Potatoes may spread blight to tomatoes, so keep them apart. Do no plant tomatoes near walnut trees.",75 days to harvest,Green,Green,Yellow,Purple; Small fruit; No need to prune suckers; CHERRY; Above 50° is optimal; 40° is minimal,3.5,,,,,
1036,Juliet Grape Tomato,Lycopersicon esculentum,Like-OH-purr-see-cone es-COE-len-tum,,"Fruits avg. 2–2.25” x 1.25–1.5”, weighing 1.5–2 oz. Typically 12–18 fruits per cluster. Delicious, rich tomato flavor. Good crack resistance, vine storage, and shelf life.",44630,40°,,48-60”,36-48”,,"Another sensitive plant when it comes to companions, tomatoes benefit from asparagus, basil, beans, borage, carrots, celery, chives, collards, cucumber, garlic, lettuce, marigold, mint, nasturtium, onion, parsley, and peppers. Avoid planting alongside Brassicas and dill. Corn will attract tomato pests, and kohlrabi will stunt tomatoes’ growth. Potatoes may spread blight to tomatoes, so keep them apart. Do no plant tomatoes near walnut trees.",60-70 Days to harvest,Green,Green,Yellow,Red; Small fruith; GRAPE; Above 50° is optimal; 40° is minimal,5,,,,,
1037,La Roma III Tomato,Lycopersicon esculentum,Like-OH-purr-see-cone es-COE-len-tum,,"4-6 oz. bright red pear-shaped fruit are thick and meaty. This early, vigorous and heavy producer is great for paste, sauces, ketchup, cooking and canning because of its low seed count. Disease tolerant VF.",44630,40°,,34-48”,24-36”,,"Another sensitive plant when it comes to companions, tomatoes benefit from asparagus, basil, beans, borage, carrots, celery, chives, collards, cucumber, garlic, lettuce, marigold, mint, nasturtium, onion, parsley, and peppers. Avoid planting alongside Brassicas and dill. Corn will attract tomato pests, and kohlrabi will stunt tomatoes’ growth. Potatoes may spread blight to tomatoes, so keep them apart. Do no plant tomatoes near walnut trees.",62-75 days to harvest,Green,Green,Yellow,Red; Medium fruit; No need to prune suckers; PASTE; Above 50° is optimal; 40° is minimal,3.5,,,,,
1038,Lemon Boy Tomato,Lycopersicon esculentum,Like-OH-purr-see-cone es-COE-len-tum,,"Beautiful 7-8 oz. globed lemon yellow fruit turns gold with maturity. Vigorous. 3-4 inches in diameter has yellow color inside and out. High yielding, mild low acid flavor is great for those who can t eat red tomatoes. Plants adapt well to variable conditions. Grow in Full Sun for sweetest flavor.",44630,40°,,48-60”,"36""",,"Another sensitive plant when it comes to companions, tomatoes benefit from asparagus, basil, beans, borage, carrots, celery, chives, collards, cucumber, garlic, lettuce, marigold, mint, nasturtium, onion, parsley, and peppers. Avoid planting alongside Brassicas and dill. Corn will attract tomato pests, and kohlrabi will stunt tomatoes’ growth. Potatoes may spread blight to tomatoes, so keep them apart. Do no plant tomatoes near walnut trees.",72 days to harvest,Green,Green,Yellow,Yellow; Medium-Large fruit; SALAD/SLICING; Above 50° is optimal; 40° is minimal,3.5,,,,,
1039,Lemon Cherry Tomato,Lycopersicon esculentum,Like-OH-purr-see-cone es-COE-len-tum,,"A summer treat fresh from the vine! Plant produces high yields of 1/2 oz. pale yellow fruits with an irresistible sweet, juicy flavor. Ideal for container gardening.",44630,40°,,36-48”,24-36”,,"Another sensitive plant when it comes to companions, tomatoes benefit from asparagus, basil, beans, borage, carrots, celery, chives, collards, cucumber, garlic, lettuce, marigold, mint, nasturtium, onion, parsley, and peppers. Avoid planting alongside Brassicas and dill. Corn will attract tomato pests, and kohlrabi will stunt tomatoes’ growth. Potatoes may spread blight to tomatoes, so keep them apart. Do no plant tomatoes near walnut trees.",58-60 Days to harvest,Green,Green,Yellow,Yellow; Very Small fruit; CURRANT; Above 50° is optimal; 40° is minimal,3.5,,,,,
1040,Marriage Cherokee Carbon Tomato,Lycopersicon esculentum,Like-OH-purr-see-cone es-COE-len-tum,,"Large, robust beefsteak tomatoes that weigh an average of 10 to 12 oz. The unblemished fruits have a beautiful dark purple coloring and they are full of rich, sweet yet tangy tomato flavor.",44630,40°,,48-60”,18-24”,,"Another sensitive plant when it comes to companions, tomatoes benefit from asparagus, basil, beans, borage, carrots, celery, chives, collards, cucumber, garlic, lettuce, marigold, mint, nasturtium, onion, parsley, and peppers. Avoid planting alongside Brassicas and dill. Corn will attract tomato pests, and kohlrabi will stunt tomatoes’ growth. Potatoes may spread blight to tomatoes, so keep them apart. Do no plant tomatoes near walnut trees.",75-80 Days to harvest,Green,Green,Yellow,Purple; Large fruit; BEEFSTEAK; SLICING; Above 50° is optimal; 40° is minimal,3.5,,,,,
1041,Mega Bite Tomato,Lycopersicon esculentum,Like-OH-purr-see-cone es-COE-len-tum,,"With fruit that are 3-4 inches in diameter, these beefsteaks weigh between 3-6 oz. Expect up to 60 tomatoes from every plant. Compact enough to grow in a container yet strong enough to grow big fruit. The fruit is round, beautiful and resistant to cracks.",44630,40°,,18-24”,18-24”,,"Another sensitive plant when it comes to companions, tomatoes benefit from asparagus, basil, beans, borage, carrots, celery, chives, collards, cucumber, garlic, lettuce, marigold, mint, nasturtium, onion, parsley, and peppers. Avoid planting alongside Brassicas and dill. Corn will attract tomato pests, and kohlrabi will stunt tomatoes’ growth. Potatoes may spread blight to tomatoes, so keep them apart. Do no plant tomatoes near walnut trees.",65-75 Days to harvest,Green,Green,Yellow,Red; Medium fruit; No need to prune suckers; SALAD/SLICING; Above 50° is optimal; 40° is minimal,3.5,,,,,
1042,Mortgage Lifter Tomato,Lycopersicon esculentum,Like-OH-purr-see-cone es-COE-len-tum,,"Noteworthy for its exceptionally large, meaty, deliciously sweet tomatoes. Produces heavy yields of 1-2 lb. fruit, but can grow up to 4 lbs. Developed by a gardener in the 1930 s, sold them for $1 a piece, paid off his mortgage in 6 yrs. 16-64 oz.",44630,40°,,48-60”,24-36”,,"Another sensitive plant when it comes to companions, tomatoes benefit from asparagus, basil, beans, borage, carrots, celery, chives, collards, cucumber, garlic, lettuce, marigold, mint, nasturtium, onion, parsley, and peppers. Avoid planting alongside Brassicas and dill. Corn will attract tomato pests, and kohlrabi will stunt tomatoes’ growth. Potatoes may spread blight to tomatoes, so keep them apart. Do no plant tomatoes near walnut trees.",70-80 days to harvest,Green,Green,Yellow,Red; XL fruit; BEEFSTEAK; Above 50° is optimal; 40° is minimal,3.5,,,,,
1043,Moskovich Tomato,Lycopersicon esculentum,Like-OH-purr-see-cone es-COE-len-tum,,"Fruits are early, deep red, and will set under 55 degrees. Rich flavor and a smooth-globe shaped fruit that weigh 4-6 oz. They have a small stem scar and are great eaten fresh or processed. Highly resistant to cracking.",44630,40°,,48-60”,24-36”,,"Another sensitive plant when it comes to companions, tomatoes benefit from asparagus, basil, beans, borage, carrots, celery, chives, collards, cucumber, garlic, lettuce, marigold, mint, nasturtium, onion, parsley, and peppers. Avoid planting alongside Brassicas and dill. Corn will attract tomato pests, and kohlrabi will stunt tomatoes’ growth. Potatoes may spread blight to tomatoes, so keep them apart. Do no plant tomatoes near walnut trees.",55-65 days to harvest,Green,Green,Yellow,Red; Medium fruit; SALAD/SLICING; PASTE; Above 50° is optimal; 40° is minimal,3.5,,,,,
1044,Pineapple Tomato,Lycopersicon esculentum,Like-OH-purr-see-cone es-COE-len-tum,,"Delicious, very sweet, tangy, meaty & weighs up to 2 lbs. The huge fruit is often striped in red boasting fewer seeds and more solid interiors. Very high yielding. Grow in Full Sun for sweetest flavor. 16-32 oz.",44630,40°,,48-60”,24-36”,,"Another sensitive plant when it comes to companions, tomatoes benefit from asparagus, basil, beans, borage, carrots, celery, chives, collards, cucumber, garlic, lettuce, marigold, mint, nasturtium, onion, parsley, and peppers. Avoid planting alongside Brassicas and dill. Corn will attract tomato pests, and kohlrabi will stunt tomatoes’ growth. Potatoes may spread blight to tomatoes, so keep them apart. Do no plant tomatoes near walnut trees.",90 days to harvest,Green,Green,Yellow,Yellow; Giant fruit; BEEFSTEAK; Above 50° is optimal; 40° is minimal,3.5,,,,,
1045,Rocky Tomato,Lycopersicon esculentum,Like-OH-purr-see-cone es-COE-len-tum,,"This is an incredibly large paste tomato, with each meaty fruit growing to 6 inches long and weighing between 8 and 12 ozs.",44630,40°,,48-60”,"24""",,"Another sensitive plant when it comes to companions, tomatoes benefit from asparagus, basil, beans, borage, carrots, celery, chives, collards, cucumber, garlic, lettuce, marigold, mint, nasturtium, onion, parsley, and peppers. Avoid planting alongside Brassicas and dill. Corn will attract tomato pests, and kohlrabi will stunt tomatoes’ growth. Potatoes may spread blight to tomatoes, so keep them apart. Do no plant tomatoes near walnut trees.",70-75 Days to harvest,Green,Green,Yellow,Red; Large fruit; SLICING; PASTE; Above 50° is optimal; 40° is minimal,3.5,,,,,
1046,Ruby Crush Tomato,Lycopersicon esculentum,Like-OH-purr-see-cone es-COE-len-tum,,"This variety has sugar-acid balanced fruits that resist cracking. Smooth, bright red fruits are solid, oval, and weigh about 1/2 ounce each. Unlike other determinate grape varieties, compact plants are strong, have good leaf cover preventing sun damage and require minimal support.",44630,40°,,18-24”,15-18”,,"Another sensitive plant when it comes to companions, tomatoes benefit from asparagus, basil, beans, borage, carrots, celery, chives, collards, cucumber, garlic, lettuce, marigold, mint, nasturtium, onion, parsley, and peppers. Avoid planting alongside Brassicas and dill. Corn will attract tomato pests, and kohlrabi will stunt tomatoes’ growth. Potatoes may spread blight to tomatoes, so keep them apart. Do no plant tomatoes near walnut trees.",60-70 Days to harvest,Green,Green,Yellow,Red; Small fruit; No need to prune suckers; GRAPE/CURRANT; Above 50° is optimal; 40° is minimal,3.5,,,,,
1047,San Marzano Tomato,Lycopersicon esculentum,Like-OH-purr-see-cone es-COE-len-tum,,"Most famous of all paste tomatoes. Household name throughout Italy and the rest of Europe. Very productive plants produce 3 1/2 inch long pear shaped, meaty plum tomatoes that are great for making sauces. 5-8 oz.",44630,40°,,48-60”,22-26”,,"Another sensitive plant when it comes to companions, tomatoes benefit from asparagus, basil, beans, borage, carrots, celery, chives, collards, cucumber, garlic, lettuce, marigold, mint, nasturtium, onion, parsley, and peppers. Avoid planting alongside Brassicas and dill. Corn will attract tomato pests, and kohlrabi will stunt tomatoes’ growth. Potatoes may spread blight to tomatoes, so keep them apart. Do no plant tomatoes near walnut trees.",75-80 Days to harvest,Green,Green,Yellow,Red; Medium-Large fruit; PASTE; Above 50° is optimal; 40° is minimal,3.5,,,,,
1048,Siberian Tomato,Lycopersicon esculentum,Like-OH-purr-see-cone es-COE-len-tum,,Sets fruit early with clusters of bright tomatoes that weigh up to 5 oz. Compact bush habit. Plants will set fruit even in low temperatures of 40 degrees F. One of the earliest on the market. Undocumented lore is that this variety was smuggled out of the Soviet Union in 1975.,44630,40°,,24-36”,24-36”,,"Another sensitive plant when it comes to companions, tomatoes benefit from asparagus, basil, beans, borage, carrots, celery, chives, collards, cucumber, garlic, lettuce, marigold, mint, nasturtium, onion, parsley, and peppers. Avoid planting alongside Brassicas and dill. Corn will attract tomato pests, and kohlrabi will stunt tomatoes’ growth. Potatoes may spread blight to tomatoes, so keep them apart. Do no plant tomatoes near walnut trees.",50 days to harvest,Green,Green,Yellow,Red; Medium fruit; No need to prune suckers; SALAD; Above 50° is optimal; 40° is minimal,3.5,,,,,
1049,Silvery Fir Tree Tomato,Lycopersicon esculentum,Like-OH-purr-see-cone es-COE-len-tum,,"Silver carrot-like leaf makes this a very unique and unusual looking tomato. Compact plant great in the garden or patio pots. Though smaller than many later cultivars, these red skinned tomatoes make a flavorful and colorful addition to green salads. 5-6 oz.",44630,40°,,24-36”,18-24”,,"Another sensitive plant when it comes to companions, tomatoes benefit from asparagus, basil, beans, borage, carrots, celery, chives, collards, cucumber, garlic, lettuce, marigold, mint, nasturtium, onion, parsley, and peppers. Avoid planting alongside Brassicas and dill. Corn will attract tomato pests, and kohlrabi will stunt tomatoes’ growth. Potatoes may spread blight to tomatoes, so keep them apart. Do no plant tomatoes near walnut trees.",55-65 days to harvest,Green,Green,Yellow,Red; Medium-Large fruit; No need to prune suckers; SLICING; Above 50° is optimal; 40° is minimal,3.5,,,,,
1050,Skyreacher Tomato,Lycopersicon esculentum,Like-OH-purr-see-cone es-COE-len-tum,,"A garden standout! Very pretty, good flavor, strong plant. Small, round slicer has a beautiful striped red-orange exterior. Upright habit. 4-6 oz.",44630,40°,,30-48”,30-36”,,"Another sensitive plant when it comes to companions, tomatoes benefit from asparagus, basil, beans, borage, carrots, celery, chives, collards, cucumber, garlic, lettuce, marigold, mint, nasturtium, onion, parsley, and peppers. Avoid planting alongside Brassicas and dill. Corn will attract tomato pests, and kohlrabi will stunt tomatoes’ growth. Potatoes may spread blight to tomatoes, so keep them apart. Do no plant tomatoes near walnut trees.",70-75 Days to harvest,Green,Green,Yellow,Red/Orange; Medium fruit; SALAD/SLICER; Above 50° is optimal; 40° is minimal,3.5,,,,,
1051,Snow White Tomato,Lycopersicon esculentum,Like-OH-purr-see-cone es-COE-len-tum,,Uncommonly delicious sweet fruity flavor. 1.5 inches in size. They ripen to pale yellow and are very sweet with just enough acid to balance. 1-1.5 oz.,44630,40°,,60-68”,36-48”,,"Another sensitive plant when it comes to companions, tomatoes benefit from asparagus, basil, beans, borage, carrots, celery, chives, collards, cucumber, garlic, lettuce, marigold, mint, nasturtium, onion, parsley, and peppers. Avoid planting alongside Brassicas and dill. Corn will attract tomato pests, and kohlrabi will stunt tomatoes’ growth. Potatoes may spread blight to tomatoes, so keep them apart. Do no plant tomatoes near walnut trees.",75-85 days to harvest,Green,Green,Yellow,White; Small fruit; CHERRY; Above 50° is optimal; 40° is minimal,3.5,,,,,
1052,Striped German Tomato,Lycopersicon esculentum,Like-OH-purr-see-cone es-COE-len-tum,,"Super-flavored, red and yellow bicolored fruit has unusually well-defined stripes. Flat, medium to large sized with ribbed shoulders. 12-42 oz.",44630,40°,,48-60”,24-36”,,"Another sensitive plant when it comes to companions, tomatoes benefit from asparagus, basil, beans, borage, carrots, celery, chives, collards, cucumber, garlic, lettuce, marigold, mint, nasturtium, onion, parsley, and peppers. Avoid planting alongside Brassicas and dill. Corn will attract tomato pests, and kohlrabi will stunt tomatoes’ growth. Potatoes may spread blight to tomatoes, so keep them apart. Do no plant tomatoes near walnut trees.",75-85 days to harvest,Green,Green,Yellow,Red/Yellow striped; Giant fruit; BEEFSTEAK; SLICING; Above 50° is optimal; 40° is minimal,3.5,,,,,
1053,Stupice Tomato,Lycopersicon esculentum,Like-OH-purr-see-cone es-COE-len-tum,,"This Czech heirloom is a prolific producer of 2-2 1/2 inch round, ultra juicy fruit on a compact bush. Produces early with high yields in clusters of bright red delicious tomatoes. Great for patio pots. 3-4 oz.",44630,40°,,36-48”,24-36”,,"Another sensitive plant when it comes to companions, tomatoes benefit from asparagus, basil, beans, borage, carrots, celery, chives, collards, cucumber, garlic, lettuce, marigold, mint, nasturtium, onion, parsley, and peppers. Avoid planting alongside Brassicas and dill. Corn will attract tomato pests, and kohlrabi will stunt tomatoes’ growth. Potatoes may spread blight to tomatoes, so keep them apart. Do no plant tomatoes near walnut trees.",55 days to harvest,Green,Green,Yellow,Red; Medium fruit; No need to prune suckers; SALAD; Above 50° is optimal; 40° is minimal,3.5,,,,,
1054,Sub Arctic Plenty Tomato,Lycopersicon esculentum,Like-OH-purr-see-cone es-COE-len-tum,,"Produces good yields of 4 oz. red tomatoes. One of the world s earliest tomatoes, sets fruit under 50 degrees F. Disease resistant VF. Allegedly developed by the US Military in the 1940 s to provide fresh tomatoes to the troops in Greenland.",44630,40°,,48-60”,24-36”,,"Another sensitive plant when it comes to companions, tomatoes benefit from asparagus, basil, beans, borage, carrots, celery, chives, collards, cucumber, garlic, lettuce, marigold, mint, nasturtium, onion, parsley, and peppers. Avoid planting alongside Brassicas and dill. Corn will attract tomato pests, and kohlrabi will stunt tomatoes’ growth. Potatoes may spread blight to tomatoes, so keep them apart. Do no plant tomatoes near walnut trees.",45-55 days to harvest,Green,Green,Yellow,Red; Medium fruit; No need to prune suckers; SALAD/SLICER; Above 50° is optimal; 40° is minimal,3.5,,,,,
1055,Sungold Tomato,Lycopersicon esculentum,Like-OH-purr-see-cone es-COE-len-tum,,"The sweet-tart flavor is simply amazing. Golden-orange fruits are borne in large clusters. The flavor develops early, so this little tomato is great for snacking a week before full maturity, when it becomes very sweet and delicious. 1 oz.",44630,40°,,48-60”,36-48”,,"Another sensitive plant when it comes to companions, tomatoes benefit from asparagus, basil, beans, borage, carrots, celery, chives, collards, cucumber, garlic, lettuce, marigold, mint, nasturtium, onion, parsley, and peppers. Avoid planting alongside Brassicas and dill. Corn will attract tomato pests, and kohlrabi will stunt tomatoes’ growth. Potatoes may spread blight to tomatoes, so keep them apart. Do no plant tomatoes near walnut trees.",65 days to harvest,Green,Green,Yellow,Yellow Orange; Small fruit; CHERRY; Above 50° is optimal; 40° is minimal,5,,,,,
1056,SunSugar Tomato,Lycopersicon esculentum,Like-OH-purr-see-cone es-COE-len-tum,,Fruit matures early and just keeps going. This golden yellow cherry packs terrific tang as well as high sugar content into every small fruit. They ripen early turning from green to yellow and finally rich shades of gold. 1 oz.,44630,40°,,48-60”,18-24”,,"Another sensitive plant when it comes to companions, tomatoes benefit from asparagus, basil, beans, borage, carrots, celery, chives, collards, cucumber, garlic, lettuce, marigold, mint, nasturtium, onion, parsley, and peppers. Avoid planting alongside Brassicas and dill. Corn will attract tomato pests, and kohlrabi will stunt tomatoes’ growth. Potatoes may spread blight to tomatoes, so keep them apart. Do no plant tomatoes near walnut trees.",62-67 Days to harvest,Green,Green,Yellow,Yellow; Medium fruit; CHERRY; Above 50° is optimal; 40° is minimal,5,,,,,
1057,Super Fantastic Tomato,Lycopersicon esculentum,Like-OH-purr-see-cone es-COE-len-tum,,"Produces heavy yields of large, round red tomatoes all season long. Juicy, meaty and very flavorful. 10 oz.",44630,40°,,48-60”,24-36”,,"Another sensitive plant when it comes to companions, tomatoes benefit from asparagus, basil, beans, borage, carrots, celery, chives, collards, cucumber, garlic, lettuce, marigold, mint, nasturtium, onion, parsley, and peppers. Avoid planting alongside Brassicas and dill. Corn will attract tomato pests, and kohlrabi will stunt tomatoes’ growth. Potatoes may spread blight to tomatoes, so keep them apart. Do no plant tomatoes near walnut trees.",70-75 Days to harvest,Green,Green,Yellow,Red; Large fruit; BEEFSTEAK; SLICING; Above 50° is optimal; 40° is minimal,5,,,,,
1058,Sweet 100 Tomato,Lycopersicon esculentum,Like-OH-purr-see-cone es-COE-len-tum,,"hey are perfect for snacking, salads, and even juice. Super Sweet 100 lives up to its name, especially when harvested at the peak of ripeness. The indeterminate vines continue bearing until frost.1-1.5 oz.",44630,40°,,30-48”,30-36”,,"Another sensitive plant when it comes to companions, tomatoes benefit from asparagus, basil, beans, borage, carrots, celery, chives, collards, cucumber, garlic, lettuce, marigold, mint, nasturtium, onion, parsley, and peppers. Avoid planting alongside Brassicas and dill. Corn will attract tomato pests, and kohlrabi will stunt tomatoes’ growth. Potatoes may spread blight to tomatoes, so keep them apart. Do no plant tomatoes near walnut trees.",65 Days to harvest,Green,Green,Yellow,Red/Orange; Medium fruit; SALAD/SLICER; Above 50° is optimal; 40° is minimal,5,,,,,
1059,Tumbler Tomato,Lycopersicon esculentum,Like-OH-purr-see-cone es-COE-len-tum,,"Cascading vines are prolific, offering extra early cherry-sized tomatoes. 1-1.5 oz.",44630,40°,,12-18”,36-60”,,"Another sensitive plant when it comes to companions, tomatoes benefit from asparagus, basil, beans, borage, carrots, celery, chives, collards, cucumber, garlic, lettuce, marigold, mint, nasturtium, onion, parsley, and peppers. Avoid planting alongside Brassicas and dill. Corn will attract tomato pests, and kohlrabi will stunt tomatoes’ growth. Potatoes may spread blight to tomatoes, so keep them apart. Do no plant tomatoes near walnut trees.",50 days to harvest,Green,Green,Yellow,Red; Medium fruit; No need to prune suckers; CHERRY;,20,,,,,
1060,Tumbling Tom Tomato,Lycopersicon esculentum,Like-OH-purr-see-cone es-COE-len-tum,,"Luscious red cherries right at eye level. Perfect for hanging baskets, window-boxes, and tall containers. It will dangle about 2  over the sides. 1 oz.",44630,40°,,18-24”,18-24”,,"Another sensitive plant when it comes to companions, tomatoes benefit from asparagus, basil, beans, borage, carrots, celery, chives, collards, cucumber, garlic, lettuce, marigold, mint, nasturtium, onion, parsley, and peppers. Avoid planting alongside Brassicas and dill. Corn will attract tomato pests, and kohlrabi will stunt tomatoes’ growth. Potatoes may spread blight to tomatoes, so keep them apart. Do no plant tomatoes near walnut trees.",70 Days to harvest,Green,Green,Yellow,Red; Medium fruit; No need to prune suckers; CHERRY;,20,,,,,
1061,Tumbling Tom Yellow Tomato,Lycopersicon esculentum,Like-OH-purr-see-cone es-COE-len-tum,,"Perfect for hanging baskets and containers, this plant cascades 18 inches over the container s edge, bearing lots of yellow 1-2 cherry tomatoes that area deliciously sweet. Plants grow about 6"" wide so you can place several in a 10 or 12"" pot for a very attractive display. Great for limited space. 1 oz.""",44630,40°,,18-24”,6-12”,,"Another sensitive plant when it comes to companions, tomatoes benefit from asparagus, basil, beans, borage, carrots, celery, chives, collards, cucumber, garlic, lettuce, marigold, mint, nasturtium, onion, parsley, and peppers. Avoid planting alongside Brassicas and dill. Corn will attract tomato pests, and kohlrabi will stunt tomatoes’ growth. Potatoes may spread blight to tomatoes, so keep them apart. Do no plant tomatoes near walnut trees.",65-70 days to harvest,Green,Green,Yellow,Yellow; Medium fruit; No need to prune suckers; CHERRY;,20,,,,,
