,VARIETY,BOTANICAL_NAME,PRONUNCIATION,ALIASES,DESCRIPTION,ZONE,MIN_TEMP,DIFFICULTY,HEIGHT,SPREAD,GROWTH_RATE,COMPANION_PLANTS,BLOOMING_FRUITING,SUMMER_FOLIAGE,FALL_FOLIAGE,FLOWER_COLOR,USES_CHARACTERISTICS,PRICE,DEER_RESISTANT,DROUGHT_TOLERANT,ATTRACTS_POLLINATORS,GROUND_COVER,OTHER
438,Assorted Sugar Buzz Series Bee Balm,Monarda,,Bergamot; Horsemint,A favourite of both butterflies and hummingbirds. Beebalm spreads quickly: reduce clump size in early spring. Garden selections all have been bred from native North American wildflower species. Good heat tolerance. Flowers are edible.,4,-30°,,20-24”,16-20”,,,Summer,,,,"Attracts bees, butterflies, hummingbitds; Deer Resistant; Drought tolerant when established; Fragrant",9,,,,,
439,Assorted Sugar Buzz Series Bee Balm,Monarda,,Bergamot; Horsemint,A favourite of both butterflies and hummingbirds. Beebalm spreads quickly: reduce clump size in early spring. Garden selections all have been bred from native North American wildflower species. Good heat tolerance. Flowers are edible.,4,-30°,,17-19”,16-18”,,,Summer,,,,"Attracts bees, butterflies, hummingbitds; Deer Resistant; Drought tolerant when established; Fragrant",9,,,,,
440,Assorted Balmy Series Bee Balm,Monarda didyma,,Bergamot; Horsemint,A favourite of both butterflies and hummingbirds. Beebalm spreads quickly: reduce clump size in early spring. Garden selections all have been bred from native North American wildflower species. Good heat tolerance. Flowers are edible.,4,-30°,,12-14”,10-12”,,,Summer,,,,"Attracts bees, butterflies, hummingbitds; Deer Resistant; Drought tolerant when established; Fragrant",9,,,,,
441,Fireball Bee Balm,Monarda didyma,,Bergamot; Horsemint,A favourite of both butterflies and hummingbirds. Beebalm spreads quickly: reduce clump size in early spring. Garden selections all have been bred from native North American wildflower species. Good heat tolerance. Flowers are edible.,4,-30°,,18-24”,12-18”,,,Summer,,,,Attracts Butterflies and hummingbirds; Deer Resistant; Evergreen,9,,,,,
442,Rosylva Forget-Me-Not,Myosotis sylvatica,,,"Biennial or short-lived perennials that self-seed to come back for many years. After flowering, discard all but a few plants, in order to produce seed for next year.",3,-40°,,6-8”,6-8”,,,Spring,,,,Attracts Butterflies and hummingbirds; Deer Resistant; Drought tolerant when established; Fragrant; Massed.,8,,,,,
443,Junior Walker Catmint,Nepeta faassenii,,,This compact Nepeta retains the non-reseeding quality of its popular parent  Walker s Low  at one third its size. Blue-green foliage contracts nicely with lavender-blue flowers.,3,-40°,,14-18”,24-30”,,,Spring - Fall,,,,Attracts Butterflies and hummingbirds; Deer Resistant; Drought tolerant when established; Fragrant; Massed.,4.5,,,,,
444,Kitten Around Catmint,Nepeta faassenii,,,"Compact and petite, this plant forms a tight, round mound of aromatic foliage. The perfect size for mixed containers, edging a sunny border or filling in small places in the garden.",3,-40°,,12-14”,20-22”,,,Spring - Fall,,,,Attracts Butterflies and hummingbirds; Deer Resistant; Drought tolerant when established; Fragrant; Massed.,4.5,,,,,
445,Little Trudy (Psfike) Catmint,Nepeta faassenii,,,"Grows in spreading mounds and features finely textured, grey-green leaves. The aroma is almost irresistible to our feline friends. Shear back the initial flower spikes for continuous bloom.",3,-40°,,6-12”,12-18”,,,Spring - Fall,,,,Attracts Butterflies and hummingbirds; Deer Resistant; Drought tolerant when established; Fragrant; Massed.,4.5,,,,,
446,Purrsian Blue Catmint,Nepeta faassenii,,,This is a very floriferous selection whose flower power is amplified by its having its flowers spaced closely together on the stems.,3,-40°,,12-18”,18-30”,,,Spring - Fall,,,,Attracts Butterflies and hummingbirds; Deer Resistant; Drought tolerant when established; Fragrant; Massed.,8,,,,,
447,Six Hills Giant Catmint,Nepeta faassenii,,,"This taller catmint is among the hardiest of the Nepetas and most tolerant of damp conditions as well as the longest flowering. Broad and vigorous, free flowering, tough and long lived. Good in hot, dry places.",3,-40°,,24-36”18-,12-18”,,,Spring - Fall,,,,Attracts Butterflies and hummingbirds; Deer Resistant; Drought tolerant when established; Fragrant; Massed.,8,,,,,
448,Walker's Low Catmint,Nepeta racemosa,,,"Low mounding, clean-cut look that lasts all summer. This plant produced large lavender-blue flowers. Excellent for front of the border.",3,-40°,,18-24”,18-24”,,,Spring - Fall,,,,NATIVE; WILD FLOWER; INVASIVE; GROUND COVER; Drought tolerant when established;,8,,,,,
449,Siskiyou Pink Oenothera,Oenothera berlandiera,,"Evening Primrose, Sundrops","This is a vigorous, spreading plant that will form a low patch of small leaves. Excellent choice for hot, dry slopes, this is a little too aggressive for the rock garden or border: place carefully. Use as a ground cover to take advantage of its spreading nature. Easily divided in spring.",3,-40°,,6-8”,24-30”,,,Summer - Fall,,,,Deer Resistant; Drought tolerant when established;,4.5,,,,,
450,Ozark Sundrops,Oenothera missouriensis,,,Open cup-shaped flowers on sprawling stems. Very tolerant of hot sites and any soils. Opens late in the day and closes before morning.,3,-40°,,8-12”,16-20”,,,Summer - Fall,,,,Deer Resistant; Attracts Butterflies,8,,,,,
451,Purple Maiden Oregano,Origanum vulgare,,,Brilliant deep purple flower spikes in mid-summer to fall with deep green leaves. Has a spreading habit. A culinary herb that grows as a ground cover.,3,-40°,,12-15”,12-18”,,,Mid summer - Frost,,,,Deciduous; Containers; Deer Resistant; Ground Cover; Leaves may be trimmed to the ground in late fall or early spring. Plants may be divided in spring every 3 to 4 years if desired.,4.5,,,,,
452,The King Ostrich Fern,Ostrich Fern,,,"This selection is extremely hardy and reported to grow up to 50% larger than its native parent. Plants form a large, upright clump of big green fronds creating a tropical look. Edible fiddleheads but caution, cook thoroughly before consuming (in moderation). Easy and carefree.",3,-40°,,48-70”,36-60”,,,,,,,"Deer Resistant; Fragrant; Cut flower; Attracts Butterflies; Usually they don t flower the first year, until they get established.",0,,,,,
453,Bartzella Peony,Paeonia itoh,,,"Itoh Peonies are rare, unusual hybrids between Garden Peonies & Tree Peonies. Peonies seldom need to be divided or moved, but if necessary it should be carried out only in the fall. Flowering is always best in a sunny location. Clean up the dead leaves in the fall to help prevent disease problems. Plants usually die to the ground, or to very low woody stems for the winter. (double yellow)",3,-40°,,25-30”,30-36”,,,Summer,,,,"Deer Resistant; Fragrant; Cut flower; Attracts Butterflies; Usually they don t flower the first year, until they get established.",27,,,,,
454,Benjamin Franklin Peony,Paeonia lactiflora,,Garden Peony,"Forms an upright bush of dark green leaves, remaining attractive all season. Fragrant. Seldom need to be divided or moved, but if necessary it should be carried out only in the fall. Trim off old stems to the ground in late fall, to help prevent disease problems. Red double.",3,-40°,,24-36”,30-36”,,,summer,,,,"Deer Resistant; Fragrant; Cut flower; Attracts Butterflies; Usually they don t flower the first year, until they get established.",14,,,,,
455,Blush Queen Peony,Paeonia lactiflora,,Garden Peony,"Forms an upright bush of dark green leaves, remaining attractive all season. Fragrant. Seldom need to be divided or moved, but if necessary it should be carried out only in the fall. Trim off old stems to the ground in late fall, to help prevent disease problems. Double white.",3,-40°,,28-32”,24-30”,,,summer,,,,"Deer Resistant; Fragrant; Cut flower; Attracts Butterflies; Usually they don t flower the first year, until they get established.",14,,,,,
456,Bowl of Beauty Peony,Paeonia lactiflora,,Garden Peony,"Forms an upright bush of dark green leaves, remaining attractive all season. Fragrant. Seldom need to be divided or moved, but if necessary it should be carried out only in the fall. Trim off old stems to the ground in late fall, to help prevent disease problems. Single pink.",3,-40°,,26-30”,24-36”,,,summer,,,,"Deer Resistant; Fragrant; Cut flower; Attracts Butterflies; Usually they don t flower the first year, until they get established.",14,,,,,
457,Coral Sunset Peony,Paeonia lactiflora,,Garden Peony,"Forms an upright bush of dark green leaves, remaining attractive all season. Fragrant. Seldom need to be divided or moved, but if necessary it should be carried out only in the fall. Trim off old stems to the ground in late fall, to help prevent disease problems. Pink, semi-double.",3,-40°,,30-36”,24-30”,,,summer,,,,"Deer Resistant; Fragrant; Cut flower; Attracts Butterflies; Usually they don t flower the first year, until they get established.",27,,,,,
458,Dr. Alexander Fleming Peony,Paeonia lactiflora,,Garden Peony,"Forms an upright bush of dark green leaves, remaining attractive all season. Fragrant. Seldom need to be divided or moved, but if necessary it should be carried out only in the fall. Trim off old stems to the ground in late fall, to help prevent disease problems. Double pink.",3,-40°,,26-30”,16-18”,,,Summer,,,,"Deer Resistant; Fragrant; Cut flower; Attracts Butterflies; Usually they don t flower the first year, until they get established.",14,,,,,
459,Duchesse de Nemours Peony,Paeonia lactiflora,,Garden Peony,"Forms an upright bush of dark green leaves, remaining attractive all season. Fragrant. Seldom need to be divided or moved, but if necessary it should be carried out only in the fall. Trim off old stems to the ground in late fall, to help prevent disease problems. Double white.",3,-40°,,18-24”,24-36”,,,summer,,,,"Deer Resistant; Fragrant; Cut flower; Attracts Butterflies; Usually they don t flower the first year, until they get established.",14,,,,,
460,Felix Crousse Peony,Paeonia lactiflora,,Garden Peony,"Forms an upright bush of dark green leaves, remaining attractive all season. Fragrant. Seldom need to be divided or moved, but if necessary it should be carried out only in the fall. Trim off old stems to the ground in late fall, to help prevent disease problems. Double red.",3,-40°,,28-36”,24-36”,,,summer,,,,"Deer Resistant; Fragrant; Cut flower; Attracts Butterflies; Usually they don t flower the first year, until they get established.",14,,,,,
461,Festiva Maxima Peony,Paeonia lactiflora,,Garden Peony,"Forms an upright bush of dark green leaves, remaining attractive all season. Fragrant. Seldom need to be divided or moved, but if necessary it should be carried out only in the fall. Trim off old stems to the ground in late fall, to help prevent disease problems. Double white.",3,-40°,,24-36”,24-36”,,,summer,,,,"Deer Resistant; Fragrant; Cut flower; Attracts Butterflies; Usually they don t flower the first year, until they get established.",27,,,,,
462,Kansas Peony,Paeonia lactiflora,,Garden Peony,"Forms an upright bush of dark green leaves, remaining attractive all season. Fragrant. Seldom need to be divided or moved, but if necessary it should be carried out only in the fall. Trim off old stems to the ground in late fall, to help prevent disease problems. Double red.",3,-40°,,32-36”,20-24”,,,summer,,,,"Deer Resistant; Fragrant; Cut flower; Attracts Butterflies; Usually they don t flower the first year, until they get established.",14,,,,,
463,Karl Rosenfield Peony,Paeonia lactiflora,,Garden Peony,"Forms an upright bush of dark green leaves, remaining attractive all season. Fragrant. Seldom need to be divided or moved, but if necessary it should be carried out only in the fall. Trim off old stems to the ground in late fall, to help prevent disease problems. Double red.",3,-40°,,28-36”,24-36”,,,summer,,,,"Deer Resistant; Fragrant; Cut flower; Attracts Butterflies; Usually they don t flower the first year, until they get established.",14,,,,,
464,Koppius Peony,Paeonia lactiflora,,Garden Peony,"Forms an upright bush of dark green leaves, remaining attractive all season. Fragrant. Seldom need to be divided or moved, but if necessary it should be carried out only in the fall. Trim off old stems to the ground in late fall, to help prevent disease problems. Double pink.",3,-40°,,35-47”,12-36”,,,summer,,,,"Deer Resistant; Fragrant; Cut flower; Attracts Butterflies; Usually they don t flower the first year, until they get established.",14,,,,,
465,Monsieur Jules Elie Peony,Paeonia lactiflora,,Garden Peony,"Forms an upright bush of dark green leaves, remaining attractive all season. Fragrant. Seldom need to be divided or moved, but if necessary it should be carried out only in the fall. Trim off old stems to the ground in late fall, to help prevent disease problems. Double pink.",3,-40°,,30-40”,24-30”,,,summer,,,,"Deer Resistant; Fragrant; Cut flower; Attracts Butterflies; Usually they don t flower the first year, until they get established.",14,,,,,
466,Sarah Bernhardt Peony,Paeonia lactiflora,,Garden Peony,"Forms an upright bush of dark green leaves, remaining attractive all season. Fragrant. Seldom need to be divided or moved, but if necessary it should be carried out only in the fall. Trim off old stems to the ground in late fall, to help prevent disease problems. Double pink.",3,-40°,,30-40”,30-36”,,,summer,,,,"Deer Resistant; Fragrant; Cut flower; Attracts Butterflies; Usually they don t flower the first year, until they get established.",14,,,,,
467,Shirley Temple Peony,Paeonia lactiflora,,Garden Peony,"Forms an upright bush of dark green leaves, remaining attractive all season. Fragrant. Seldom need to be divided or moved, but if necessary it should be carried out only in the fall. Trim off old stems to the ground in late fall, to help prevent disease problems. White double.",3,-40°,,30-32”,24-36”,,,summer,,,,"Deer Resistant; Fragrant; Cut flower; Attracts Butterflies; Usually they don t flower the first year, until they get established.",27,,,,,
468,Alba Plena Memorial Day Peony,Paeonia officinalis,,Common Peony,"Plants form an upright bush of dark green leaves that stays attractive all season. Peonies seldom need to be divided or moved, but if necessary it should be carried out only in the fall. Trim off old stems to the ground in late fall, to help prevent disease problems.",3,-40°,,22-24”,28-36”,,,Summer,,,,"Deer Resistant; Fragrant; Cut flower; Attracts Butterflies; Usually they don t flower the first year, until they get established.",14,,,,,
469,Rubra Plena Memorial Day Peony,Paeonia officinalis,,Common Peony,"Plants form an upright bush of dark green leaves that stays attractive all season. Peonies seldom need to be divided or moved, but if necessary it should be carried out only in the fall. Trim off old stems to the ground in late fall, to help prevent disease problems. Red double.",3,-40°,,26-30”,28-36”,,,Summer,,,,Deer Resistant,14,,,,,
470,Heavy Metal Switch Grass,Panicum virgatum,,,"Leaves are glaucous-blue with a very upright, compact habit. Its upright nature creates a formal appearance, softened only by its delicate seed heads that turn dark burgundy in fall. Well suited for border plantings.",3,-40°,,60-72”,24-36”,,,,,,,Deer Resistant; Cut flower,8,,,,,
471,Hot Rod Switch Grass,Panicum virgatum,,,"This cultivar goes from blue to red faster and earlier than any other, the upright foliage starts out blue-green and then turns to deep maroon earlier in the season than most switch grasses, the maroon color intensifies as the season progresses. Medium tall clumping grass with rigid upright stems.",4,-30°,,36-40”,30-36”,,,,,,,Deer Resistant; drought tolerant,8,,,,,
472,Northwind Switch Grass,Panicum virgatum,,,"A tall ornamental grass which features one of the best vertical forms of any Panicum. The leaves are olive-green to bluish-green. The plant forms a compact, narrow, thick leafed, erect clump. Topped in late summer by finely textured yellow plumes. Foliage turn yellow-beige in fall. Tolerates dry and wet soil, drought and air pollution.",2,-50°,,24-36”,24-36”,,,Late summer - Frost,,,,Deer Resistant; drought tolerant when established,8,,,,,
473,Ruby Ribbons Switch Grass,Panicum virgatum,,,"Soft green foliage is late to start in spring on upright, clumping plants. Foliage takes on a wine-red color in early summer adding some great color. Flowers appear in late summer followed by ornamental seed heads throughout the fall and winter season.",4,-30°,,42-48”,24-36”,,,Summer - frost,,,,Deer Resistant; drought tolerant when established,8,,,,,
474,Shenandoah Switch Grass,Panicum virgatum,,,Best burgundy coloring of all the panicums turning deep red by mid summer. Could be mistaken for Japanese Blood grass. Tolerates a wide range of soil. Slower growing than other Panicums.,4,-30°,,42-48”,29-35”,,,,,,,Deer Resistant; drought tolerant when established,8,,,,,
475,Alpine Alpine Poppy,Papaver alpinum,,,"Forms low rosettes of ferny olive-green leaves, bearing upright stems of satiny flowers. A short-lived perennial, but will usually self-seed in a delightful sort of way. Removing faded flowers will greatly increase the blooming season.",3,-40°,,,,,,Summer,,,,Attracts Butterflies; Deer Resistant; drought tolerant when established; massed,4.5,,,,,
476,Garden Gnome Icelandic Poppy,Papaver Icelandic,,,"Forms low rosettes of ferny olive-green leaves, bearing upright stems of satiny flowers. A short-lived perennial, but will usually self-seed in a delightful sort of way. Removing faded flowers will greatly increase the blooming season.",2,-50°,,12-18”,8-12”,,,Spring - Early summer,,,,Attracts Butterflies; Deer Resistant; drought tolerant when established; massed,0,,,,,
477,Champagne Bubbles Mix Iceland Poppy,Papaver nudicaule,,,"Forms low rosettes of ferny olive-green leaves, bearing upright stems of satiny flowers. A short-lived perennial, but will usually self-seed in a delightful sort of way. Removing faded flowers will greatly increase the blooming season.",2,-50°,,12-18”,8-12”,,,Spring - Early summer,,,,Attracts Butterflies; Deer Resistant; drought tolerant when established; massed,4.5,,,,,
478,Wonderland Mix Iceland Poppy,Papaver nudicaule,,,"Forms low rosettes of ferny olive-green leaves, bearing upright stems of satiny flowers. A short-lived perennial, but will usually self-seed in a delightful sort of way. Removing faded flowers will greatly increase the blooming season.",3,-40°,,10-15”,8-12”,,,Spring - Early summer,,,,Attracts Butterflies; Deer Resistant; drought tolerant when established; massed,4.5,,,,,
479,Spring Fever Series Mix Poppy,Papaver nudicaule,,,"Forms low rosettes of ferny olive-green leaves, bearing upright stems of satiny flowers. A short-lived perennial, but will usually self-seed in a delightful sort of way. Removing faded flowers will greatly increase the blooming season.",3,-40°,,10-12”,8-10”,,,Spring - Early summer,,,,Attracts Butterflies; Deer Resistant; drought tolerant when established; massed,8,,,,,
480,Spring Fever Series Orange Poppy,Papaver nudicaule,,,"Forms low rosettes of ferny olive-green leaves, bearing upright stems of satiny flowers. A short-lived perennial, but will usually self-seed in a delightful sort of way. Removing faded flowers will greatly increase the blooming season.",3,-40°,,10-12”,8-10”,,,Spring - Early summer,,,,Attracts Butterflies; Deer Resistant; drought tolerant when established; massed,8,,,,,
481,Spring Fever Series Red Poppy,Papaver nudicaule,,,"Forms low rosettes of ferny olive-green leaves, bearing upright stems of satiny flowers. A short-lived perennial, but will usually self-seed in a delightful sort of way. Removing faded flowers will greatly increase the blooming season.",3,-40°,,10-12”,8-10”,,,Spring - Early summer,,,,Attracts Butterflies; Deer Resistant; drought tolerant when established; massed,8,,,,,
482,Spring Fever Series Yellow Poppy,Papaver nudicaule,,,"Forms low rosettes of ferny olive-green leaves, bearing upright stems of satiny flowers. A short-lived perennial, but will usually self-seed in a delightful sort of way. Removing faded flowers will greatly increase the blooming season.",3,-40°,,10-12”,8-10”,,,Spring - Early summer,,,,"Attracts Butterflies, hummingbirds; Containers; Deer Resistant; Drought tolerant when established.",8,,,,,
483,Allegro Oriental Poppy,Papaver orientale,,,"Plants form a low clump of coarse, hairy leaves, and usually go dormant, disappearing completely by late summer. Clumps should be moved or divided only in late summer or fall, when the leaves begin to show again.",3,-40°,,14-24”,12-18”,,,Spring - Early summer,,,,"Attracts Butterflies, hummingbirds; Containers; Deer Resistant; Drought tolerant when established.",4.5,,,,,
484,Beauty of Livermore Oriental Poppy,Papaver orientale,,,"Plants form a low clump of coarse, hairy leaves, and usually go dormant, disappearing completely by late summer. Clumps should be moved or divided only in late summer or fall, when the leaves begin to show again.",3,-40°,,30-36”,18-24”,,,Spring - Early summer,,,,"Attracts Butterflies, hummingbirds; Containers; Deer Resistant; Drought tolerant when established.",4.5,,,,,
485,Brilliant Oriental Poppy,Papaver orientale,,,"Plants form a low clump of coarse, hairy leaves, and usually go dormant, disappearing completely by late summer. Clumps should be moved or divided only in late summer or fall, when the leaves begin to show again.",3,-40°,,30-36”,18-24”,,,Spring - Early summer,,,,"Attracts Butterflies, hummingbirds; Containers; Deer Resistant; Drought tolerant when established.",8,,,,,
486,Prince of Orange Oriental Poppy,Papaver orientale,,,"Plants form a low clump of coarse, hairy leaves, and usually go dormant, disappearing completely by late summer. Clumps should be moved or divided only in late summer or fall, when the leaves begin to show again.",3,-40°,,30-36”,18-24”,,,Spring - Early summer,,,,"Attracts Butterflies, hummingbirds; Containers; Deer Resistant; Drought tolerant when established.",8,,,,,
487,Princess Victoria Louise Oriental Poppy,Papaver orientale,,,"Plants form a low clump of coarse, hairy leaves, and usually go dormant, disappearing completely by late summer. Clumps should be moved or divided only in late summer or fall, when the leaves begin to show again.",3,-40°,,30-36”,18-24”,,,Spring - Early summer,,,,"Attracts Butterflies, hummingbirds; Containers; Deer Resistant; Drought tolerant when established.",4.5,,,,,
488,Royal Wedding Oriental Poppy,Papaver orientale,,,"Plants form a low clump of coarse, hairy leaves, and usually go dormant, disappearing completely by late summer. Clumps should be moved or divided only in late summer or fall, when the leaves begin to show again.",3,-40°,,30-36”,18-24”,,,Spring - Early summer,,,,"Deciduous. Foliage: Green; Fall Foliage: Orangey-Red; Massed; GROUND COVER on slopes; Ornamental berries; Walls, fences or trellises; Prune heavily in early spring. Drought tolerant when established.",8,,,,,
489,Virginia Creeper Vine,Parthenocissus quinquefolia,,,"This fast growing vine easily clings to walls and other surfaces for a quick cover, with more open growth than its cousin Boston Ivy. Works well as a ground cover, blanketing unsightly areas. Its small, purple-black, ornamental berries are a good winter food source for birds.",4,-30°,,30-50,,,,Spring,,,,Deer Resistant; drought tolerant when established,0,,,,,
490,Hameln Dwarf Fountain Grass,Pennisetum alopecuroides,,,"Leaves are of a finer texture. Blooms in late summer. Seed heads appear in July and open greenish-white, turning a creamy-tan.",4,-30°,,12-24”,18-24”,,,,,,,"Attracts Butterflies, hummingbirds; Drought tolerant when established",8,,,,,
491,Rondo Mix Beardtongue,Penstemon barbatus,,,"Remove faded flowers to encourage continued blooming. Clumps may be easily divided in early spring. Unlike many of the taller selections, this one is ruggedly hardy in colder regions.",3,-40°,,16-20”,12-18”,,,Mid summer - Frost,,,,"Attracts Butterflies, hummingbirds; Deer Resistant; WILD FLOWER",9,,,,,
492,Dark Towers Beardtongue,Penstemon digitalis,,,"Plants form a sturdy mound of leaves, beet-red during the spring and fall, greener in summer. Outstanding for foliage effect in the border, but also useful in tubs and mixed containers. Clumps may be easily divided in spring or fall.",3,-40°,,30-36”,24-30”,,,Summer,,,,"Attracts Butterflies, hummingbirds; Deer Resistant; WILD FLOWER",9,,,,,
493,Husker Red Beardtongue,Penstemon digitalis,,,"Plants form a sturdy mound of leaves, beet-red during the spring and fall, greener in summer. Outstanding for foliage effect in the border, but also useful in tubs and mixed containers. Clumps may be easily divided in spring or fall.",3,-40°,,30-36”,18-24”,,,Summer,,,,"Attracts Butterflies, hummingbirds; Deer Resistant; WILD FLOWER",9,,,,,
494,Prairie Twilight Beardtongue,Penstemon digitalis,,,"Plants form a sturdy mound of leaves, beet-red during the spring and fall, greener in summer. Outstanding for foliage effect in the border, but also useful in tubs and mixed containers. Clumps may be easily divided in spring or fall.",3,-40°,,21-24”,24-30”,,,Summer,,,,"Attracts Butterflies, hummingbirds; Containers; Deer Resistant; Drought tolerant when established; Fragrant; Massed",9,,,,,
