,VARIETY,BOTANICAL_NAME,PRONUNCIATION,ALIASES,DESCRIPTION,ZONE,MIN_TEMP,DIFFICULTY,HEIGHT,SPREAD,GROWTH_RATE,COMPANION_PLANTS,BLOOMING_FRUITING,SUMMER_FOLIAGE,FALL_FOLIAGE,FLOWER_COLOR,USES_CHARACTERISTICS,PRICE,DEER_RESISTANT,DROUGHT_TOLERANT,ATTRACTS_POLLINATORS,GROUND_COVER,OTHER
796,Mambo Watermelon,Citrullus lanatus,Sit-RULL-us lan-AH-tus,,"enjoy multiple, perfectly round melons with a beautiful dark green rind and deep red flesh. The sweet crisp flesh is extremely tasty and holds well (doesn’t overripen) if you can’t harvest them right away. Each 9” fruit will weigh about 11 pounds at maturity, which is only 75 days from transplant. A smaller seed cavity means you almost get the look of a seedless melon but the superior taste of a seeded melon.",,40°,,12-24”,72-96”,,"Great companions for corn, marigolds, nasturtiums, pumpkin, radish, squash, and sunflowers. Avoid planting near potatoes. Melon leaves are full of calcium, so they’re good for the compost heap.",75 days to harvest,Green,Green,Yellow,Hybrid; 3-4 fruits per plant; Early; Icebox Watermelon; Few seeds; Containers; Raised Beds,0,,,,,
797,Mini Love Watermelon,Citrullus lanatus,Sit-RULL-us lan-AH-tus,Asian Watermelon,"This personal-sized Asian watermelon is perfect for smaller families and smaller gardens. Shorter vines (3-4 feet) still produce up to six fruits per plant and can be grown in smaller spaces. The crack and split resistant rinds are important for reducing crop loss. For culinary purposes, this deep red-fleshed watermelon has a thin but strong rind. Mini Love has a high sugar content resulting in sweet and crisp, juicy flesh that will be a true summer delight for watermelon lovers.",,40°,,"36""","36""",,"Great companions for corn, marigolds, nasturtiums, pumpkin, radish, squash, and sunflowers. Avoid planting near potatoes. Melon leaves are full of calcium, so they’re good for the compost heap.",70 Days to harvest,Green,Green,Yellow,"Hybrid; Compact; 7-9 pound fruit; Sweet, refreshing, few seeds; Containers; Raised Beds",0,,,,,
798,Secretariat Seedless Watermelon,Citrullus lanatus,Sit-RULL-us lan-AH-tus,,"Secretariat is a fast maturing watermelon with high yields. This seedless watermelon offers a smooth, medium-green exterior with green stripes and has a nice round-oval shape. The flesh is firm, crisp, deep red flesh.",,40°,,12-24”,"60-72""",,"Great companions for corn, marigolds, nasturtiums, pumpkin, radish, squash, and sunflowers. Avoid planting near potatoes. Melon leaves are full of calcium, so they’re good for the compost heap.",80 Days to harvest,Green,Green,Yellow,Hybrid; Seedless; Pollinizer included; Containers; Raised Beds; Delicious,0,,,,,
799,Sugar Baby Watermelon,Citrullus lanatus,Sit-RULL-us lan-AH-tus,,"This small, round melon is called an icebox type because it is petite enough to fit in the refrigerator. This widely adapted heirloom variety is solid, dark green on the outside with a bright red, firm and fine-grained flesh that is super sweet. Watermelon contains high levels of healthy antioxidants, making Sugar Baby a great sweet way to pack in good nutrition. Vines are compact. Plant about 4 feet apart.",,40°,,12-24”,"60-72""",,"Great companions for corn, marigolds, nasturtiums, pumpkin, radish, squash, and sunflowers. Avoid planting near potatoes. Melon leaves are full of calcium, so they’re good for the compost heap.",75 days to harvest,Green,Green,Yellow,Heirloom; Icebox Watermelon; Diploid (seeded); 8-10 pound fruits; Containers; Raised Beds; Delicious and Sweet,0,,,,,
800,Tendersweet Orange Watermelon,Citrullus lanatus,Sit-RULL-us lan-AH-tus,,"The Tendersweet Orange Watermelon is an excellent quality watermelon with a unique juicy, bright orange flesh with a wonderful sweet flavor. This unique watermelon also is a kid favorite with it's bright coloring.",,40°,,"18-36""",36-72”,,"Great companions for corn, marigolds, nasturtiums, pumpkin, radish, squash, and sunflowers. Avoid planting near potatoes. Melon leaves are full of calcium, so they’re good for the compost heap.",85 Days to harvest,Green,Green,Yellow,Heirloom; Open Pollinated; Picnic watermelon; Diploid (Seeded); Containers; Raised Beds; Trellis,0,,,,,
801,Top Gun Watermelon,Citrullus lanatus,Sit-RULL-us lan-AH-tus,,"The Top Gun Watermelon produces more uniform shaped and better quality fruit than any other Crimson Sweets. This watermelon variety is an exceptionally delicious hybrid that has an improved flesh quality with a delicious bright red color. The Top Gun Watermelon has an excellent seedling vigor that is able to get the crop off to the right start, making it a top watermelon.",,40°,,12-14”,36-72”,,"Great companions for corn, marigolds, nasturtiums, pumpkin, radish, squash, and sunflowers. Avoid planting near potatoes. Melon leaves are full of calcium, so they’re good for the compost heap.",83 Days to harvest,Green,Green,Yellow,Hybrid; Picnic Watermelon; Containers; Raised Beds; Gardens; Trellis; Diploid (Seeded),0,,,,,
802,Twilight Seedless Watermelon,Citrullus lanatus,Sit-RULL-us lan-AH-tus,,"Our only seedless icebox type! Extra-sweet, bright red, crisp, juicy flesh. About a week earlier than most open pollinated types. Nearly black fruits similar to Sugar Baby. Round fruits weigh about 6 to 8 pounds – perfect to fit in the fridge! Pollinator included.",,40°,,12-24”,"60-72""",,"Great companions for corn, marigolds, nasturtiums, pumpkin, radish, squash, and sunflowers. Avoid planting near potatoes. Melon leaves are full of calcium, so they’re good for the compost heap.",85 Days to harvest,Green,Green,Yellow,Hybrid; Seedless; Icebox Watermelon; Small; Sweet; Containers; Raised Bed,0,,,,,
803,Lemon Drop Watermelon,Citrullus vulgaris,Sit-RULL-us vlu-GAR-is,,"An outstanding and super rare all-golden mini melon. Baker Creek has been searching for an all-yellow watermelon for many years. These incredibly small and early producing melons are just what we’ve been pining after-- a rich lemon-yellow color from skin to flesh! Like striking gold, this glorious gilded watermelon was the stuff of dreams and legend. The excitement was palpable as these Asian type, pocket sized melons began to ripen on vine at the trials. We were thrilled with the vigorous growing habit and productivity; each vine blossoming and providing perfect single serving sized 1-2 pound fruit with flavor that is unparalleled, candy sweet and crispy textured. A perfect little snacking melon with super thin rind. In fact, the flesh is edible all the way down to the skin. A perfect home garden or local market melon, as the thin skin is not well suited to long distance shipping. The vines produce tons of the personal sized melons. Will throw a small percentage of green skinned fruit.",,40°,,"24-36""","60-72""",,"Great companions for corn, marigolds, nasturtiums, pumpkin, radish, squash, and sunflowers. Avoid planting near potatoes. Melon leaves are full of calcium, so they’re good for the compost heap.",70 Days to harvest,Green,Green,Yellow,Heirloom; Prolific;,0,,,,,
804,Pot Selection Cilantro,Coriandrum sativum,core-EE-ann-drum sa-TEE-vum,,"The classic Mexican herb. Every part of Cilantro is edible. While the leaves and stems of the plant have a bold spicy flavor, the seeds are sweet and mild. For best flavor, the leaves are best when picked young and somewhat small. When the seed pods dry, harden and turn brown, they are ripe and ready for harvest.",,32°,,12-24”,12-18”,,,,,,,Open Pollinated; Containers; Raised Beds;,4,,,,,
805,Santo Cilantro,Coriandrum sativum,core-EE-ann-drum sa-TEE-vum,,"Aromatic, flavorful leaves (cilantro) and seeds (coriander). Reseeds.",,32°,,12-18”,8-12”,,,,,,,Open Pollinated; Containers; Raised Beds;,4,,,,,
806,Slow Bolt Cilantro,Coriandrum sativum,core-EE-ann-drum sa-TEE-vum,Coriander,"Slow bolt cilantro is a delicious herb that is found in some of the most popular south American cuisine. It’s also one of the most popular herbs around the world. Cilantro usually goes to seed pretty quickly. It tends not to like heat. The slow bolt variety is more tolerant to heat, giving you a longer harvesting time. Make yourself a great meal with this popular herb.",,28°,,"12-18""","2-4""",,"Repels aphids, potato beetles, and spider mites.",50 days to harvest,Green,Green,,Open Pollinated; Longer season than regular cilantro; Containers; Raised Beds;,0,,,,,
807,Ambrosia Cantaloupe Melon,Cucumis melo,kyoo-KUH-miss mel-OH,,"Luscious, extra-sweet taste, juicy with nectarous aroma. The thick, firm, flesh is delicious right down to the rind. Vines yield bumper crops and are mildew-resistant. This long-time favorite produces fruits with an attractive, orange-peach flesh that is loaded with sweetness and a rich, complex flavor. The 4-5 lb. 6 inch melons have a small seed cavity and are the perfect size.",,40°,,12-24”,36-72”,,"Great companions for corn, marigolds, nasturtiums, pumpkin, radish, squash, and sunflowers. Avoid planting near potatoes. Melon leaves are full of calcium, so they’re good for the compost heap.",86 Days to harvest,Green,Green,Yellow,Hybrid; Super delicious and juicy; Raised beds; Containers if trellised; Gardens; Greenhouses,0,,,,,
808,Aphrodite Cantaloupe Melon,Cucumis melo,kyoo-KUH-miss mel-OH,,"Tender orange flesh of succulent new sweetheart delivers pluperfect melodious honey-sweetness. Musky sweetness makes ‘Aphrodite’ the cantaloupe of choice for sublime desserts and breakfast alike. 6-8 lb. fruits capture classic, sublimely savory honey aromatics.",,40°,,12-24”,"60-72""",,"Great companions for corn, marigolds, nasturtiums, pumpkin, radish, squash, and sunflowers. Avoid planting near potatoes. Melon leaves are full of calcium, so they’re good for the compost heap.",72 days to harvest,Green,Green,Yellow,Hybrid; Early season; Compact vines; Delicious; Raised Beds; Gardens; Containers,0,,,,,
809,Armenian Yard-Long Cucumber,Cucumis melo,kyoo-KUH-miss mel-OH,,"Light green, mild tasting, deeply ribbed fruit. The elongated fruit yields uniform, easily digestible, fluted slices. They are apt to twist and coil growing on the ground, but develop nice and straight when hanging from a trellis. Fruit reaches over 24 inches long, but is best harvested at about 12 inches. This classic is actually a melon genetically. GARDEN; SLICER. Heirloom.",,40°,,"12""","18-36""",,"Plant beside asparagus, beans, Brassicas, celery, corn, dill, kohlrabi, lettuce, onion, peas, radish, and tomatoes. Avoid planting near potatoes and sage. Both corn and sunflowers can act as a trellis for cucumbers to good effect. Dill will help cucumbers by attracting predatory insects, and nasturtiums will improve the flavour and growth of cucumbers.",65 days to harvest,Green,Green,Yellow,"Heirloom; Open Pollinated; Good for salads; Gourmet; Giant size; Trellis; Slicer; Farmer's Markets; Mild, sweet and burpless",0,,,,,
810,Banana Melon,Cucumis melo,kyoo-KUH-miss mel-OH,,"Banana-shaped fruit with smooth, yellow skin and sweet, spicy, salmon-colored flesh. Melons mature at 16-24 inches long and 5-8 lbs. When ripe it reminds one of a large, overgrown banana... It smells like one, having a remarkably powerful and delicious fragrance. An all-time favorite, being very sweet and great for specialty markets.",,40°,,12-24”,"60-72""",,"Great companions for corn, marigolds, nasturtiums, pumpkin, radish, squash, and sunflowers. Avoid planting near potatoes. Melon leaves are full of calcium, so they’re good for the compost heap.",90 days to harvest,Green,Green,Yellow,Heirloom; Open Pollinated; Rare; Delicious; Containers if trellised; Raised Beds; Gardens,0,,,,,
811,Bidwell Casaba Honeydew Melon,Cucumis melo,kyoo-KUH-miss mel-OH,,"The Bidwell Casaba melon is a large uniquely shaped melon. This huge variety can grow to be 12-16 lbs., but generally weigh around 8lbs. and measure 12-15 in. long and 9 in. wide. The unique Bidwell Casaba has a mildly sweet and delicious orange flesh.",,40°,,12-24”,"60-72""",,"Great companions for corn, marigolds, nasturtiums, pumpkin, radish, squash, and sunflowers. Avoid planting near potatoes. Melon leaves are full of calcium, so they’re good for the compost heap.",90 days to harvest,Green,Green,Yellow,Heirloom; Unique; Delicious; Raised Beds; Gardens; Containers if Trellised,0,,,,,
812,Brilliant Canary Melon,Cucumis melo,kyoo-KUH-miss mel-OH,,"Sweet and juicy Canary type. The smooth yellow melons avg. 5–5 1/2 inches X 4 1/2–5 1/2 inches and about 4 lb. Flesh is very sweet and juicy. Harvest when fruit turns dark yellow, at forced-slip stage, or cut from vine.",,40°,,12-24”,"60-72""",,"Great companions for corn, marigolds, nasturtiums, pumpkin, radish, squash, and sunflowers. Avoid planting near potatoes. Melon leaves are full of calcium, so they’re good for the compost heap.",75 days to harvest,Green,Green,Yellow,Hybrid; Sweet; Container if trellised; Raised Beds; Gardens,0,,,,,
813,Crenshaw Melon,Cucumis melo,kyoo-KUH-miss mel-OH,,"closely resembles its parent melon, the Casaba. The Crenshaw Melon is a large pear-shaped cantaloupe with a juicy flesh. These large melons have a wonderful sweet flavor. Crenshaw is definitely a family favorite that grows best in warm, dry climates. Its dense yet tender peach-colored flesh is very sweet and slightly spicy. The melon’s skin turns golden-yellow at the peak of ripeness and will have slightly waxy feel. Crenshaw melons are quite large, averaging 8 to 10 pounds in weight.",,40°,,12-24”,"60-84""",,"Great companions for corn, marigolds, nasturtiums, pumpkin, radish, squash, and sunflowers. Avoid planting near potatoes. Melon leaves are full of calcium, so they’re good for the compost heap.",110 days to harvest,Green,Green,Yellow,Heirloom; Sweet; Delicious; Containers; Raised beds; Trellis,0,,,,,
814,Earli Dew Honeydew Melon,Cucumis melo,kyoo-KUH-miss mel-OH,,"Earli Dew is the earliest round, 2-1/2 to 3 lb. creamy-green honeydew hybrid we've seen. The smooth melons have a distinctive lime green flesh of excellent flavor and texture. Earli-dew slips at maturity like a muskmelon. Intermediate resistance to fusarium wilt.",,40°,,12-24”,"60-72""",,"Great companions for corn, marigolds, nasturtiums, pumpkin, radish, squash, and sunflowers. Avoid planting near potatoes. Melon leaves are full of calcium, so they’re good for the compost heap.",80 Days to harvest,Green,Green,Yellow,"Hybrid; For shorter seasons; Heavy yielding; Very sweet; 5-6 inch, 3lb. fruits; Gardens; Raised beds; Containers if trellised",0,,,,,
815,Emerald Green Gem Cantaloupe,Cucumis melo,kyoo-KUH-miss mel-OH,Charentais Melon; French Cantaloupe,"Emerald Green Gem is truly an emerald green gem! This early, green skinned melon has a sweet yellow-orange flesh that has a sweet and somewhat spicy flavor! This variety can grow up to 3 pounds.",,40°,,12-24”,"60-84""",,"Great companions for corn, marigolds, nasturtiums, pumpkin, radish, squash, and sunflowers. Avoid planting near potatoes. Melon leaves are full of calcium, so they’re good for the compost heap.",70-90 Days to harvest,Green,Green,Yellow,"Heirloom; Fruits grow to 2-3 pounds; Pale orange, juicy flesh; Sweet and somewhat spicy flavor; Heavy producer; Containers; Trellis; Raised Bed; Gardens",0,,,,,
816,Escorial Melon,Cucumis melo,kyoo-KUH-miss mel-OH,French Melon,"Extra-early Charentais. Escorial matures nearly a week before Savor to serve the early Charentais market. Fruits avg. 2 lb. and are round to round-oval with pronounced sutures and moderate netting. Flesh is dark orange, very sweet, and aromatic. When ripe, outer skin is green with a yellowish tinge.",,40°,,12-24”,72-96”,,"Great companions for corn, marigolds, nasturtiums, pumpkin, radish, squash, and sunflowers. Avoid planting near potatoes. Melon leaves are full of calcium, so they’re good for the compost heap.",72 days to harvest,Green,Green,Yellow,Hybrid; Early season; Delicious; Containers if trellised; Raised Beds; Gardens,0,,,,,
817,Goddess Cantaloupe Melon,Cucumis melo,kyoo-KUH-miss mel-OH,,Goddess melon produces 4-6 lb. fruit in only 68 days. Grow this melon to get a jump on the competition - it outperforms all other early melon varieties. Oval shaped fruit has slight suturing and medium-coarse netting. Goddess’ orange flesh is very flavorful and produces sugars that rival main season varieties.,,40°,,12-24”,"60-72""",,"Great companions for corn, marigolds, nasturtiums, pumpkin, radish, squash, and sunflowers. Avoid planting near potatoes. Melon leaves are full of calcium, so they’re good for the compost heap.",68 Days to harvest,Green,Green,Yellow,Hybrid; Very early season; Delicious; Gardens; Raised Beds; Containers if trellised,0,,,,,
818,Golden Beauty Casaba Melon,Cucumis melo,kyoo-KUH-miss mel-OH,,"Considered one of the finest quality Casabas, this sweet white-fleshed fruit has a tough golden rind. An excellent keeper that can be stored well into the winter. Direct seed or transplant after danger of frost has passed. For the best melons, there is a short window of time between the transcendent flavor of perfectly ripe and perfectly rotten. To catch a melon at its peak, check the patch every other day when it's getting close, looking for tell-tale signs of cracking around the stem and full aromas. Those fruits must absolutely be harvested and eaten on the same day. For a more failsafe harvest indicator, fruit is ready when it slips easily from the vine. Beware! Deer loooove perfectly ripe melons too, so guard your patch well! Nutrients: vitamins A and C, (very high in both), K, B6, niacin, folate, potassium, magnesium, manganese and copper.",,40°,,12-24”,72-96”,,"Great companions for corn, marigolds, nasturtiums, pumpkin, radish, squash, and sunflowers. Avoid planting near potatoes. Melon leaves are full of calcium, so they’re good for the compost heap.",100 days to harvest,Green,Green,Yellow,Heirloom; Delicious; Honeydew; Containers; Raised Beds; Greenhouses; Trellis,0,,,,,
819,Ha Ogen Galia Honeydew Melon,Cucumis melo,kyoo-KUH-miss mel-OH,,"Unique green-fleshed melon with refreshing, honeyed flavor. Flesh is smooth and juicy with a relatively thin, smooth rind. Haogen is one of the best melons, with soft sweet flesh, dripping with sugar. The smaller size makes it perfect for short season areas, and the coloring is spectacular. Harvest promptly when skin turns yellow with green ribs.",,40°,,12-24”,"60-72""",,"Great companions for corn, marigolds, nasturtiums, pumpkin, radish, squash, and sunflowers. Avoid planting near potatoes. Melon leaves are full of calcium, so they’re good for the compost heap.",80 Days to harvest,Green,Green,Yellow,"Heirloom; Open Pollinated; Organic seeds; Approximately 6-10, very sweet and juicy 5 inch, 3–5 pound melons; Super sweet; Raised Beds; Gardens; Containers if trellised",0,,,,,
820,Hale’s Best Jumbo Cantaloupe Melon,Cucumis melo,kyoo-KUH-miss mel-OH,,"overnight muskmelon sensation, owing its popularity to excellent flavor with earliness. Beautifully ribbed oval melon with deep-green skin and golden netting. Firm, salmon-toned flesh is aromatic and sweet. Thrives in hot weather. Plant at the base of a trellis so vines can climb.",,40°,,12-24”,36-72”,,"Great companions for corn, marigolds, nasturtiums, pumpkin, radish, squash, and sunflowers. Avoid planting near potatoes. Melon leaves are full of calcium, so they’re good for the compost heap.",80 Days to harvest,Green,Green,Yellow,Heirloom; Early season; Delicious; Containers if trellised; Gardens; Raised Beds,0,,,,,
821,Honey Blonde melon,Cucumis melo,kyoo-KUH-miss mel-OH,,"Flavorful yellow-skinned honeydew. The attractive oval fruits avg. 3–3 1/2 lb., and have delicious orange flesh. Plants are strong and vigorous and perform well in warm or cool weather.",,40°,,12-24”,72-96”,,"Great companions for corn, marigolds, nasturtiums, pumpkin, radish, squash, and sunflowers. Avoid planting near potatoes. Melon leaves are full of calcium, so they’re good for the compost heap.",72 days to harvest,Green,Green,Yellow,Hybrid;,0,,,,,
822,Honey Rock Cantaloupe Melon,Cucumis melo,kyoo-KUH-miss mel-OH,,"Honey Rock is a great tasting, early maturing heirloom melon with good yields of quality fruit. This melon variety produces compact 3-4 lbs fruits that are early to mature in just 80 days! Honey Rock's flesh is a tender salmon-orange hue with a delicate sweet taste.",,40°,,12-24”,72-96”,,"Great companions for corn, marigolds, nasturtiums, pumpkin, radish, squash, and sunflowers. Avoid planting near potatoes. Melon leaves are full of calcium, so they’re good for the compost heap.",80 Days to harvest,Green,Green,Yellow,"Heirloom; Small, early season; Containers if trellised; Raised beds; Gardens",0,,,,,
823,Juane Canary Melon,Cucumis melo,kyoo-KUH-miss mel-OH,,"The Juane Canary Melon is an old heirloom football shaped melon with a canary yellow rind and a creamy, white to green flesh. This 4-5 pound melon has a delicious sugar sweet taste that is perfect for summer picnics! This variety will keep well in full sun.",,40°,,12-24”,"60-72""",,"Great companions for corn, marigolds, nasturtiums, pumpkin, radish, squash, and sunflowers. Avoid planting near potatoes. Melon leaves are full of calcium, so they’re good for the compost heap.",90 days to harvest,Green,Green,Yellow,Heirloom; Delicious and sweet; French melon; 4-5 lbs.; Raised Bed; Gardens; Greenhouse; Containers if trellised,0,,,,,
824,Mango Melon,Cucumis melo,kyoo-KUH-miss mel-OH,Vine Peach,"The fruits are the size, shape and color of an orange with a texture much like a mango and a somewhat bland sweet-tart taste. Not a dessert melon, the snow white flesh is best used in preserves, pies or sweet pickles. It may also be sliced and fried like eggplant. (Pick while green for pickling). Fruits will keep a long time after picking. The vigorous, spreading, very productive vines may be staked. Fruits are ready to pick when they slip freely from the stems.",,40°,,12-24”,"60-72""",,"Great companions for corn, marigolds, nasturtiums, pumpkin, radish, squash, and sunflowers. Avoid planting near potatoes. Melon leaves are full of calcium, so they’re good for the compost heap.",80 Days to harvest,Green,Green,Yellow,Open Pollinated; Good for chicken feed; Preserves or baking;,0,,,,,
825,Minnesota Midget Cantaloupe Melon,Cucumis melo,kyoo-KUH-miss mel-OH,,"This micro melon is an early heirloom introduced to Minnesota in 1948. Measuring just 4 inches across, they have sweet, orange flesh and are perfect miniature versions of the “classic muskmelon.” Compact, 3-4-foot vines produce good yields of sweet orange orbs.",,40°,,12-24”,35-39”,,"Great companions for corn, marigolds, nasturtiums, pumpkin, radish, squash, and sunflowers. Avoid planting near potatoes. Melon leaves are full of calcium, so they’re good for the compost heap.",60-75 Days to harvest,Green,Green,Yellow,"Heirloom; Compact plant; 4 inch muskmelons; Juicy, super-sweet orange flesh; Capable of producing 2 crops; Containers; Raised beds",0,,,,,
826,Piel De Sapo Melon,Cucumis melo,kyoo-KUH-miss mel-OH,Toadskin Muskmelon,"Unique storage melon with mottled dark-green and yellow skin like a toad’s (hence “Toadskin”). The 5-7 lb. aromatic, sweet fruits with firm rinds store for several months. Include this variety in late melon plantings, then store in a cool place and enjoy as a winter treat.",,40°,,18-24”,"60-72""",,"Great companions for corn, marigolds, nasturtiums, pumpkin, radish, squash, and sunflowers. Avoid planting near potatoes. Melon leaves are full of calcium, so they’re good for the compost heap.",95 Days to harvest,Green,Green,Yellow,Heirloom; French melon; Stores well; Rare Spanish variety; Heat lover; Raised Beds; Containers; Sweet and delicious,0,,,,,
827,Rich Sweetness Canteloupe Melon,Cucumis melo,kyoo-KUH-miss mel-OH,,The Rich Sweetness is a very petite little melon that typically stays the size of a baseball! These little melons usually do not exceed a quarter pound. The inner flesh is a smooth creamy white and is very juicy! These melons live up to their name and are very aromatic. Rich Sweetness flavor is reminiscent of honeydew and cantaloupe.,,40°,,12-24”,"60-72""",,"Great companions for corn, marigolds, nasturtiums, pumpkin, radish, squash, and sunflowers. Avoid planting near potatoes. Melon leaves are full of calcium, so they’re good for the compost heap.",80 Days to harvest,Green,Green,Yellow,"Heirloom; Open Pollinated; Small 4 oz. juicy, sweet fruit; High yields; Edible ornamental; Let them ripen until they fall off the vine, then they will be flavorful",0,,,,,
828,Sakata's Sweet Melon,Cucumis melo,kyoo-KUH-miss mel-OH,"Asian Melon, Conomon","These small 3 to 4 inch round melons are very sweet with a high sugar content. Oriental varieties open a whole new dimension to melons as they are amazingly different. Crisp and crunchy­; they have edible skins. Their small size and light, golden rind make them very attractive. This fine Japanese variety was developed by Sakata’s Seed Co., of Yokohama. This is a must for marketing. They are in high demand by melon lovers and command top prices. Rare and colorful. Many can be planted in one hill.",,40°,,12-24”,"60-72""",,"Great companions for corn, marigolds, nasturtiums, pumpkin, radish, squash, and sunflowers. Avoid planting near potatoes. Melon leaves are full of calcium, so they’re good for the compost heap.",85 Days to harvest,Green,Green,Yellow,"Heirloom; Fruits grow to the size of a softball; Golden-yellow softball-sized fruits; Juicy, pale green flesh is very sweet and crisp; Can be grown on a trellis easily; Prolific; Raised Beds; Gardens; Containers",0,,,,,
